{
  "$schema": "https://json-schema.org/draft/2020-12/schema",
  "$id": "https://second-brain.local/schemas/json/proposal.schema.json",
  "title": "AI Workflow Proposal v1",
  "version": "1.0.0",
  "description": "The shared, versioned proposal envelope every Phase 4 AI workflow produces (OQ #22). A proposal is a SUGGESTION artifact: drafting it writes nothing. The human reviews the exact proposal; only then does an accept command (e.g. `sb fact accept --file`, `sb output create --file`) validate it against this schema and perform the confirmed writes. Provenance is mandatory on every writable item.",
  "type": "object",
  "required": ["workflow", "version", "proposed_at", "items"],
  "additionalProperties": false,
  "properties": {
    "workflow": {
      "type": "string",
      "enum": ["extract_facts", "braindump", "review", "compose_output"],
      "description": "Which AI workflow produced this proposal."
    },
    "version": {
      "const": 1,
      "description": "Envelope version. Breaking changes bump this."
    },
    "proposed_at": {
      "type": "string",
      "format": "date-time",
      "description": "When the proposal was drafted (ISO-8601)."
    },
    "items": {
      "type": "array",
      "minItems": 1,
      "description": "The proposed items. Item shape is workflow-specific (see allOf); braindump/review items are interactive suggestions applied via existing confirmed commands and stay free-form objects here."
    }
  },
  "allOf": [
    {
      "$comment": "extract_facts — every item is a fact with full provenance (OQ #23: duplicates are surfaced by the skill, not auto-deduped here).",
      "if": { "properties": { "workflow": { "const": "extract_facts" } }, "required": ["workflow"] },
      "then": { "properties": { "items": { "items": { "$ref": "#/$defs/factItem" } } } }
    },
    {
      "$comment": "compose_output — exactly one L5 output note per proposal (v1).",
      "if": { "properties": { "workflow": { "const": "compose_output" } }, "required": ["workflow"] },
      "then": { "properties": { "items": { "items": { "$ref": "#/$defs/outputItem" }, "maxItems": 1 } } }
    }
  ],
  "$defs": {
    "ulid": {
      "type": "string",
      "pattern": "^[0-7][0-9A-HJKMNP-TV-Z]{25}$",
      "description": "Crockford-base32 ULID."
    },
    "factItem": {
      "type": "object",
      "required": ["statement", "source_ref", "observed_at", "confidence"],
      "additionalProperties": false,
      "properties": {
        "statement": { "type": "string", "minLength": 1 },
        "source_ref": { "$ref": "#/$defs/ulid", "description": "Provenance: the note ULID this fact was extracted from. Required." },
        "observed_at": { "type": "string", "format": "date-time" },
        "confidence": { "type": "number", "minimum": 0, "maximum": 1 },
        "supersedes": { "$ref": "#/$defs/ulid", "description": "Optional: id of an existing fact this one supersedes (human picked supersede over add)." }
      }
    },
    "outputItem": {
      "type": "object",
      "required": ["title", "sources", "body"],
      "additionalProperties": false,
      "properties": {
        "title": { "type": "string", "minLength": 1 },
        "sources": {
          "type": "array",
          "minItems": 1,
          "items": { "type": "string", "minLength": 1 },
          "description": "Provenance the output cites (note/fact ids or links). Non-empty — schema-required for L5. Note ids are resolved by `sb output create` (OQ #24)."
        },
        "body": { "type": "string", "description": "The drafted output body (markdown). Every claim-bearing section must map to a cited source." },
        "tags": { "type": "array", "items": { "type": "string", "minLength": 1 }, "uniqueItems": true }
      }
    }
  }
}
